{
  "schema_version": "apps_rg.pipeline_attempt_evaluation.v1",
  "evaluation_id": "apps_rg_v2_pipeline_measurement",
  "source_identity": {
    "coverage_contract_digest": null,
    "source_contract_digests": null,
    "evaluator_version": "apps_rg.pipeline_attempt_evaluation.v1"
  },
  "cohort": {
    "status": "PENDING",
    "cohort_id": "",
    "data_split": null,
    "frozen_member_ids": [],
    "frozen_member_ids_digest": null
  },
  "attempts": []
}
